{
  "eventId": "00000000-0000-4000-8000-000000000001",
  "type": "RevisionSaved",
  "schemaVersion": 1,
  "tenantId": "00000000-0000-4000-8000-000000000002",
  "aggregateId": "00000000-0000-4000-8000-000000000003",
  "sequence": 1,
  "occurredAt": "2026-10-29T12:00:00Z",
  "correlationId": "00000000-0000-4000-8000-000000000004",
  "payload": {
    "revisionId": "00000000-0000-4000-8000-000000000005",
    "schemaVersion": 1
  }
}
